<?xml version="1.0" encoding="utf-8"?>
<!DOCTYPE resources SYSTEM "../team.dtd" []>
<resources>
  <name>Predator</name>
  <surface name="flag" file="flag.png" />
  <surface name="death_flag" file="dead.png" />
  <surface name="big_flag" file="flag64.png" />
  <team>
	<character name="Yautja" body="predator"/>
	<character name="Elder" body="predator"/>
	<character name="Wolf" body="predator"/>
	<character name="Bad blood" body="predator"/>
	<character name="Warrior" body="predator"/>
	<character name="Celtic" body="predator"/>	
	<character name="Scar" body="predator"/>
	<character name="Unblooded" body="predator"/>
	<character name="Young Blooded" body="predator"/>
	<character name="Blooded" body="predator"/>
	<character name="Predalien" body="predator"/>
	<character name="Hunter" body="predator"/>
	<character name="Tracker" body="predator"/>
	<character name="Ceremonial" body="predator"/>	
	<character name="Mortal fighter" body="predator"/>
	<character name="Neo-predator" body="predator"/>
  </team>
    <color name="teamcolor" r="246" g="15" b="44" a="55" />
</resources>
