<?xml version="1.0" encoding="utf-8"?>
<!DOCTYPE resources SYSTEM "../team.dtd" []>
<resources>
  <name>SuSE</name>
  <surface name="flag" file="flag.png" />
  <surface name="death_flag" file="dead.png" />
  <surface name="big_flag" file="flag64.png" />
  <team>
	<character name="Geeko" body="suse"/>
	<character name="opensuse" body="suse"/>
	<character name="suse_LE" body="suse"/>
	<character name="ZYpp" body="suse"/>
	<character name="Microsuse" body="suse"/>
	<character name="Minisuse" body="suse"/>	
	<character name="SUPER" body="suse"/>
	<character name="Jacklab" body="suse"/>
	<character name="YaST" body="suse"/>
	<character name="Rhampholeon GÃ¼nther" body="suse"/>
	<character name="Chamaeleonidae" body="suse"/>
	<character name="Bradypodion Fitzinger" body="suse"/>
	<character name="Brookesia Gray" body="suse"/>
	<character name="Calumma Gray" body="suse"/>	
	<character name="Chamaeleo Laurenti" body="suse"/>
	<character name="Furcifer Fitzinger" body="suse"/>
  </team>
    <color name="teamcolor" r="71" g="120" b="25" a="255" />
</resources>
