<?xml version="1.0" encoding="utf-8"?>
<!DOCTYPE resources SYSTEM "../team.dtd" []>
<resources>
  <name>Hexley</name>
  <surface name="flag" file="flag.png" />
  <surface name="death_flag" file="dead.png" />
  <surface name="big_flag" file="flag64.png" />
  <team>
    <character name="Hexley" body="hexley" />
    <character name="DarwinOS" body="hexley" />
    <character name="Ornithorhynchus anatinus" body="hexley" />
    <character name="Thomas Henry" body="hexley" />
    <character name="Charles" body="hexley" />
    <character name="XNU" body="hexley" />
    <character name="Jon Hooper" body="hexley" />
    <character name="Rhapsody" body="hexley" />
	<character name="iPhone OS" body="hexley" />
    <character name="PureDarwin" body="hexley" />
	<character name="Apple TV" body="hexley" />
  </team>
    <color name="teamcolor" r="134" g="57" b="30" a="255" />
</resources>


